{
  "product_name": "朋友圈文案助手",
  "product_goal": "帮助运营人员快速生成高质量朋友圈文案，降低内容创作门槛",
  "target_users": [
    "微商",
    "销售",
    "自媒体从业者",
    "小企业主"
  ],
  "platform": "网页应用（Web App）",
  "features": [
    {
      "name": "场景分类选择",
      "description": "提供 7 个预设场景标签供用户单选，包括产品推广、活动促销、客户见证、日常种草、个人 IP、知识分享、早安晚安。",
      "user_value": "降低用户思考成本，快速确定文案方向。"
    },
    {
      "name": "场景自由描述",
      "description": "提供文本输入框，允许用户补充具体场景描述，最多 200 字。",
      "user_value": "支持个性化场景输入，提高文案生成准确性。"
    },
    {
      "name": "场景校验逻辑",
      "description": "场景分类和场景描述至少填写一项，不满足时提示用户补充。",
      "user_value": "保证模型获得足够上下文。"
    },
    {
      "name": "风格选择",
      "description": "提供 6 个预设文案风格供单选。",
      "user_value": "控制生成内容的表达调性。"
    },
    {
      "name": "字数范围选择",
      "description": "提供 4 档字数区间供单选。",
      "user_value": "适配不同朋友圈内容长度需求。"
    },
    {
      "name": "参考示例输入",
      "description": "支持填写最多 3 条参考文案，每条最多 500 字。",
      "user_value": "让模型学习用户偏好的表达方式。"
    },
    {
      "name": "一次生成 3 条文案",
      "description": "点击生成后，系统基于当前条件返回 3 条不同文案。",
      "user_value": "提升可选性和一次生成的满意度。"
    },
    {
      "name": "一键复制",
      "description": "每条文案提供复制按钮，复制成功后展示提示。",
      "user_value": "缩短从生成到发布的操作路径。"
    },
    {
      "name": "换一批",
      "description": "在保留原条件的情况下重新生成 3 条新文案。",
      "user_value": "无需重新填写条件即可继续尝试。"
    },
    {
      "name": "返回修改条件",
      "description": "用户可返回输入视图修改条件，并保留原已填内容。",
      "user_value": "便于快速迭代输入并优化结果。"
    },
    {
      "name": "历史记录",
      "description": "在当前设备保存生成结果，可查看并再次使用",
      "user_value": "便于回溯和复用内容"
    },
    {
      "name": "收藏功能",
      "description": "将选中的文案收藏到当前设备，支持取消收藏",
      "user_value": "快速找到满意的文案"
    },
    {
      "name": "文案模板库",
      "description": "提供可选文案模板，将模板内容带入生成条件",
      "user_value": "减少重复填写"
    },
    {
      "name": "批量生成",
      "description": "提交多组场景条件并逐组展示生成结果",
      "user_value": "提高集中创作效率"
    },
    {
      "name": "配图建议",
      "description": "根据文案内容生成配图主题与构图建议",
      "user_value": "帮助完成图文发布"
    },
    {
      "name": "多语言支持",
      "description": "选择目标语言生成文案",
      "user_value": "适配不同语言的受众"
    }
  ],
  "ui_pages": [
    {
      "name": "输入页",
      "modules": [
        "场景分类选择",
        "场景描述输入",
        "风格选择",
        "字数范围选择",
        "参考示例输入",
        "生成按钮",
        "文案模板选择",
        "批量场景输入",
        "目标语言"
      ]
    },
    {
      "name": "结果页",
      "modules": [
        "3 条文案结果卡片",
        "复制按钮",
        "换一批按钮",
        "修改条件按钮",
        "历史记录",
        "收藏列表",
        "配图建议"
      ]
    }
  ],
  "interaction_notes": [
    "采用单页应用形式，通过输入页和结果页两个视图切换完成主流程。",
    "结果页支持基于原参数重新生成。",
    "返回修改条件时保留原输入内容。"
  ],
  "design_requirements": {
    "theme": "科技感暗色",
    "responsive": true,
    "style_notes": [
      "使用深色背景和高亮强调色。",
      "结果卡片需具备清晰层级和良好可读性。",
      "生成中展示明确的 loading 状态。"
    ]
  },
  "technical_constraints": {
    "auth": false,
    "database": false,
    "frontend": "React 或 Vue",
    "backend": "Serverless Function",
    "deployment": "Vercel、Netlify 等静态托管平台配合 Serverless Function",
    "llm_usage": "调用大语言模型 API，一次生成 3 条朋友圈文案。",
    "security": [
      "API Key 仅存储在服务端环境变量中。",
      "前端做输入长度限制与基础 XSS 防护。",
      "增加简单频率限制，例如每分钟最多 10 次生成。"
    ],
    "storage": "浏览器本地存储，用于历史记录与收藏"
  },
  "non_functional_requirements": {
    "performance": [
      "页面首次加载时间不超过 2 秒。",
      "AI 文案生成响应时间不超过 10 秒。"
    ],
    "usability": [
      "表单校验需提供实时反馈。",
      "生成失败时保留用户已填写内容。",
      "移动端点击区域不小于 44px。"
    ],
    "compatibility": [
      "兼容 Chrome、Safari、Firefox、Edge 等主流浏览器。"
    ]
  },
  "in_scope": [
    "单页 Web 应用开发",
    "输入页与结果页视图切换",
    "场景分类与自由描述输入",
    "风格和字数范围选择",
    "参考示例输入",
    "生成 3 条文案",
    "复制、换一批、返回修改条件",
    "响应式适配",
    "Serverless Function 中转模型调用",
    "历史记录",
    "收藏功能",
    "文案模板库",
    "批量生成",
    "配图建议",
    "多语言支持"
  ],
  "out_of_scope": [
    "用户登录注册",
    "服务端数据库存储",
    "后台管理",
    "原生 App 与小程序"
  ]
}
